{
  "root": "./source",
  "plan": {
    "schemaVersion": "1.0.0",
    "requiredAttempts": 2,
    "timeoutMs": 5000,
    "maximumOutputBytes": 65536,
    "isolation": {
      "kind": "trusted-local",
      "acknowledgedUnsafeExecution": true
    },
    "profileId": "corpus-node-test-v1",
    "suites": [
      {
        "id": "public",
        "files": [
          "public.test.mjs"
        ],
        "extraction": "COMPLETE"
      }
    ],
    "obligations": [
      {
        "id": "tests",
        "kind": "tests",
        "required": true,
        "suiteIds": [
          "public"
        ],
        "checks": [
          {
            "id": "outcome",
            "actionId": "test",
            "field": "testOutcome",
            "expected": "PASS"
          }
        ],
        "limits": []
      }
    ],
    "actions": [
      {
        "id": "test",
        "adapter": "node-test",
        "executable": "C:\\nvm4w\\nodejs\\node.exe",
        "arguments": [
          "public.test.mjs"
        ],
        "environment": {},
        "prepareFiles": [],
        "removePaths": [],
        "observe": {
          "trace": false,
          "outputs": [],
          "report": null
        }
      }
    ],
    "worlds": [
      {
        "id": "reference",
        "kind": "REFERENCE",
        "files": [],
        "discriminants": []
      },
      {
        "id": "assertion-fault",
        "kind": "TARGET",
        "files": [
          {
            "path": "public.test.mjs",
            "content": "import assert from \"node:assert/strict\";\nimport test from \"node:test\";\ntest(\"public qualification\", () => assert.equal(1, 2));\n"
          }
        ],
        "discriminants": [
          {
            "obligationId": "tests",
            "checkIds": [
              "outcome"
            ]
          }
        ]
      },
      {
        "id": "neutral",
        "kind": "NEUTRAL",
        "files": [
          {
            "path": "public.test.mjs",
            "content": "// neutral comment\nimport assert from \"node:assert/strict\";\nimport test from \"node:test\";\ntest(\"public qualification\", () => assert.equal(1, 1));\n"
          }
        ],
        "discriminants": []
      }
    ],
    "subject": {
      "commit": "corpus-commit",
      "baseCommit": "corpus-base",
      "candidateDigest": "sha256:4f53cda18c2baa0c0354bb5f9a3ecbe5ed12ab4d8e11ba873c2f11161202b945",
      "inputDigest": "sha256:b82512cb17861d7889b7fd96d35fa764b213a6a743e44f14dd10ffcba28241d1"
    },
    "tools": [
      {
        "id": "node",
        "version": "22.23.2",
        "digest": "sha256:0d0f5e39f9f3d9587bc19f73eab3c2c9c4903fd02d6dbf9c853dd81b3d95fad4"
      }
    ],
    "allowedCandidatePaths": [
      "public.test.mjs"
    ]
  },
  "planDigest": "sha256:f4aa7f4ba6636c21a88e8266d9b75bfc38526ecbe0026638d13a95a1f89ea0e2",
  "candidate": {
    "files": []
  }
}
